Name,Link,Twiter,Facebook,Instagram,Youtube,Description,LastUpdate,Location,Year Publishing,Language,Content
Kapsül,https://kapsul.com.tr/,https://twitter.com/kapsulbulten,https://m.facebook.com/kapsulbulten/posts/,https://www.instagram.com/kapsulbulten/?hl=en,https://www.youtube.com/channel/UCYPSrOM_PY1xQhFDjkxZN-g,"Launched as a digital newsroom, Kapsül (in English: Capsule) offers a daily newsletter and four weekly thematic newsletters. The daily newsletter, called Günlük Doz (in English: Daily Dose), features topics handpicked by the newsroom to reframe the most relevant news of the day. It strives to cut through the overcrowded news agenda with a slow journalism approach. The newsletter employs explanatory journalism techniques, hitting the subscribers' inboxes every weekday around 7pm Istanbul time.
The weekly newsletters publish essays on cultural, business, sports, and lifestyle topics. The subscription is free, so the team sells advertising spaces available in the text. Then, its mobile app and website aggregate the content from the newsletters.
Its social media accounts are occasionally used for breaking news.
The organisation recently launched a YouTube channel to publish short documentaries. Kapsül aims to adopt YouTube as a primary platform and redefine the outlet as a producer of narrative video journalism
Its revenue model is a mix of grants, funds from investors and advertising. According to the founder, a revenue model based on memberships or subscriptions is very hard to sustain in Turkey since the audience does not have the habit of ""paying for news"".",23-Feb,"İstanbul, Turkey",2020,Turkish,"Science, Entertainment and culture, Sports, Economy and business, Economy and finance, Education, Lifestyle, Law and crime, Environment, Politics, Health and well-being, Society and human rights, Gender, Feminism, LGBTIQ+, Ethnic minorities, Religious minorities, Refugees, Migration, War crimes and transitional justice, Technology"
Reportare,https://www.reportare.com/,https://twitter.com/reportare,https://www.facebook.com/reportare,https://www.instagram.com/reportare.r/?hl=en,https://www.youtube.com/@reportare,"Established by Sinan Dirlik and Ulvi Yaman, friends for 30 years, Reportare is Turkey's first website dedicated to publishing in-depth interviews.
The organisation uses slow journalism techniques to publish extended interviews on a wide array of topics and focusing on social justice, the global climate crisis, and gender equality.
Reportare publishes video interviews and social commentary on Youtube. The site's content is heavily focused on longform essays and in-depth text interviews, accompanied with original pictures. Some of the video interviews get selected to be published on their website, too, with transcript and pictures. The insistence on long text formats has been loosened in the last two years with increased YouTube video content.
The founders prioritised editorial independence; since the outlet's launch in 2011, they have not sought advertising or grants. All the contributors, including technical maintenance and video editing, work voluntarily.
Reportare clearly states its ethics policy and team of contributors. Since the organisation does not have a legal entity, contributing journalists and YouTube hosts are legally responsible for the content produced on the website and the channel.",,"İstanbul, Türkiye",2011,"English, Turkish, Kurdish","Entertainment and culture, Economy and business, Lifestyle, Environment, Politics, Health and well-being, Society and human rights, Gender, Feminism, LGBTIQ+, Ethnic minorities, Religious minorities, DEIA: Diversity, equity, inclusion and accessibility"
Zumiraj.me,http://zumiraj.me/,https://twitter.com/zumiraj_me,https://www.facebook.com/ZUMIRAJ,https://www.instagram.com/zumiraj.me/,,"Zumiraj.me (in English: Zoom Me) is one of the youngest media outlets in Montenegro (founded in 2022), which gathers and hires young journalists and gives them the opportunity to publish their journalistic stories.
Journalists, who publish information and stories about culture, ecology, and human rights, do not have to be part of the newsroom to publish. There are currently seven freelance investigative journalists working at the media outlet.
""Zumiraj.me is a platform where readers will have the opportunity to see a kind of portfolio of journalists' work, because all authors can publish all the stories they have done during their careers. In this way, the journalist's work and progress can be followed, as well as the topics they covered during their career. We are open to all authors and stories as long as they meet our code of ethics,"" the founder and editor-in-chief Vuk Vujisić says.
In addition to promoting the work of young journalists, Zumiraj.me focuses on stories of importance for citizens and local communities. Vujisić says the outlet's intention is to enable citizens to get the whole picture of an issue, to provide them with enough information to understand the story and, finally, to offer a solution.
The publication is currently funded through grants and is open to donations or non-monetary support in the form of equipment.
Its motto is ""Publish, share, and process"". In other words, authors publish articles, and to gain public support, the story is shared with other influential media. But the organisation's work does not end there, especially regarding stories about organised crime or environmental issues. All the information received is sent to the competent institutions, and the team monitors how these tackle the problem.",23-Jan,"Podgorica, Montenegro",2022,"English, Montenegrin, Serbian, Bosnian, Albanian, Macedonian","Science, Entertainment and culture, Economy and business, Entrepreneurship, Economy and finance, Journalism industry, Education, Lifestyle, Law and crime, Environment, Health and well-being, Society and human rights, Gender, Feminism, LGBTIQ+, Ethnic minorities, Religious minorities, DEIA: Diversity, equity, inclusion and accessibility, Refugees, Migration, War crimes and transitional justice, Technology"
PCNEN,http://www.pcnen.com/portal/,https://twitter.com/PcnenN,https://www.facebook.com/prve.crnogorske/,https://www.instagram.com/pcnen_/,,"PCNEN (an acronym for the First Montenegrin Independent Electronic Newspaper) is one of the first media outlets in Montenegro and it was started by a group of volunteers more than two decades ago, precisely in June 2000.
It represents the first successful project implemented by the non-governmental organisation PRONEN, whose goal is to encourage the development of new digital media in Montenegro. The NGO and the website were the response of a group of enthusiasts to society's demands for information and the inclusion of Montenegro in the ""civilisation of mobile text"".
The media outlet was launched during the Yugoslav wars, when the media industry was more polarised than ever. A division emerged between media organisations for and against the war, and for and against the government. The founders of PCNEN chose not to take a stand on important political issues, and instead tried to be a forum for debate and discussion. For that purpose, the organisation launched a column called Inciting Dialogue.
""It was a provocative metaphor that offered the opposite of the current state of society. They incited us to hatred and war, and we encouraged dialogue,"" says co-founder Dusko Vukovic.
A few years later, the team considered selling the media outlet. However, people from the diaspora came forward and helped with a modest amount of money, and the founders decided to keep it. According to them, it is challenging to maintain independence and enthusiasm after two decades of volunteer work.
During the last few years, PCNEN has started to be financed by project-based grant funding. However, the organisation's biggest problem is finding and retaining a team of journalists to write for the media outlet.
The readership is diverse, and a large share is the Montenegrin diaspora.",23-Jan,"Podgorica, Montenegro",2000,Montenegrin,"Science, Entertainment and culture, Sports, Economy and business, Entrepreneurship, Economy and finance, Journalism industry, Education, Lifestyle, Environment, Politics, Society and human rights, Gender, Feminism, LGBTIQ+, Ethnic minorities, Religious minorities, DEIA: Diversity, equity, inclusion and accessibility, Refugees, Migration, War crimes and transitional justice, Technology"
Tsüri.ch,https://tsri.ch/,https://twitter.com/Tsueri_ch,https://www.facebook.com/tsuerich/,https://www.instagram.com/tsri.ch/,https://www.youtube.com/channel/UCIp7eBL1Ua_39tVI-N1Dt7w,"Tsüri.ch is an independent online magazine and platform for local journalism in and around Zurich, initiated in 2015. Its founders wished to prove that young people are interested in local news and politics. It therefore targets a young audience that, according to the founders, were not being addressed sufficiently by existing local news organisations.
Beyond the regular publications on its website, Tsüri.ch uses the opportunities of the web to reach out to and interact with its audience, through its community on social media and via a variety of newsletters that reflect the diverse interests of its readers: a daily briefing, a weekly newsletter, a weekly briefing about local council meetings, a monthly climate briefing, a newsletter with competitions and raffles, and updates on the offline events organised by the media outlet.
Tsüri.ch sends a daily email news briefing at 7 am, summarising the day's most important news; a monthly newsletter; and a cultural events calendar for event tips and other helpful information.
Indeed, its concept of ""civic media"" means according to its website: ""In the past, editors could only broadcast. Thanks to the internet, it is now much easier for them to receive and interact with their community. One-way communication is broken up, and an equal relationship is created between users and journalists. For example, stories can be told as quizzes or ratings, and the community can incorporate their input directly into the reporting. Direct exchange increases the quality of journalism because the users and the editors have to deal with the content more deeply. For example as a walk, a game, a workshop, a discussion or theatre.""
Tsüri.ch has more than 1,600 paying members who are encouraged to participate actively in online discussions and offline events. In return for a voluntary ""pay what you can"" membership, Tsüri.ch offers exclusive events such as guided tours, city walks, and concerts.",23-Feb,"Zürich, Switzerland",2015,"English, German","Entertainment and culture, Economy and business, Education, Environment, Politics, Health and well-being, Society and human rights, Gender, Feminism, LGBTIQ+, DEIA: Diversity, equity, inclusion and accessibility, Refugees, Migration"
IN MEDIA RES,https://vezjak.com/,https://twitter.com/insloveniaonly,https://www.facebook.com/boris.vezjak/,,,"Established in 2016 under the slogan ""Quis custodiet ipsos custodes?"" (in English: Who guards the guardians?), the blog IN MEDIA RES (in English: In media there is truth) is one of the most critical voices in commenting on and analysing media reporting in Slovenia.
IN MEDIA RES is not formally established, does not accept donations nor sponsors and it is entirely a personal and volunteer project of its founder and sole contributor: Boris Vezjak. A self-described ""cyber dissident"" and a professor of philosophy and media at the University of Maribor, Vezjak is also an author of several books on media.
Between 2006 and 2008, Vezjak was the editor of the now-defunct media watchdog platform. His current initiative is a non-formal and non-systematic continuation of his work as an editor of the aforementioned watchdog platform, though he refuses to define it as a proper ""watchdog portal"" since the analyses in it are not systematic due to the limited capacities of the author.
The blog publishes several analyses of media reports a week, often on the same day as the media pieces that are the subject of investigation. Its contents are released as articles, opinion pieces and through the namesake IN MEDIA RES podcast.",23-Jan,"Maribor, Slovenia",2008,Slovenian,"Science, Politics"
NORadio,http://www.noradio.org/,,https://www.facebook.com/neodvisniobalniradio/,https://www.instagram.com/neodvisni.obalni.radio/,,"NORadio is an acronym for Neodvisni Obalni Radio (in English: Independent coastal radio). It also goes by the Italian name of Radio Costiera Indipendente, as it also broadcasts for the Italian minority in Slovenia and the Slovenian minority in Italy. In this sense, NORadio has a regional and, at the same time, international audience as it covers a small geographic area shared by Slovenia, Italy and Croatia.
The radio was launched in 2020 to serve and connect different communities and to help organise the NGO sector and civil society. Though its schedule includes music and culture, its aim is not to be an entertainment broadcaster, but rather to delve into stories and their contexts. It mostly runs on its founders' enthusiasm and volunteer work as it is still in its start-up phase and is in the process of creating a new website that would serve as an informative media platform.
NORadio is a brand new - now digital - chapter in Slovenia's long history of independent radio. Radio NOR creators emphasise the role of Radio Študent (Ljubljana), the oldest independent radio station in Europe, and radio Marš (Maribor) as one of its main influences to bring the spirit of independent radio to the coastal region as well.
It is also part of the Neuvrščeni national network, a network of independent, non-profit community-based media, in the so-called ""third media pillar"".",23-Jan,"Koper, Slovenia",2020,"English, Slovenian, Italian","Science, Entertainment and culture, Environment, Politics, Society and human rights, Gender, Feminism, LGBTIQ+, Ethnic minorities, Refugees, Migration, Technology"
Koridor,https://koridor-ku.si/,https://twitter.com/koridor_ku?lang=en,https://www.facebook.com/koridorku/,https://www.instagram.com/koridor_ku/?hl=en,,"Koridor started in 2014 as a social media initiative managed by volunteer students and publishing about cultural topics. Over time it has slowly professionalised, although it still mostly relies on the volunteer efforts of more than 90 part-time contributors.
Koridor covers various aspects of cultural production, notably smaller, often regional ones that are generally overlooked by mainstream media. At the same time, it also reports on national and international cultural events.
The production of Koridor includes in-depth features, essays, interviews, opinion and investigative pieces, particularly concerning cultural policy. The outlet often organises workshops or collaborates on education projects, and it strongly relies on social media, particularly Twitter, Facebook, and Instagram, to disseminate information.",23-Jan,"Ljubljana, Slovenia",2014,Slovenian,"Entertainment and culture, Education, Lifestyle"
Das Lamm,https://daslamm.ch/,https://twitter.com/magazin_daslamm,https://www.facebook.com/daslamm.ch,https://www.instagram.com/daslamm.ch/,,"Das Lamm was founded in 2012 to report independently about sustainability issues. It is an online magazine organised as an editorial collective. It is entirely free of advertising, financed by the support of its readers and not designed for profit. All articles are freely accessible to all readers in Switzerland and beyond.
Das Lamm considers sustainability not a question of individual consumption but of global structures and solidarity. For the media organisation, journalism means defending peoples' interests, drawing attention to grievances, and repeatedly showing how our society could be different. The newsroom publishes analyses, comments, and extensive background research, addressing topics that otherwise have little space in the Swiss media landscape.
Founded in a shared flat in 2012, Das Lamm (acronym: Liga der aussergewöhnlichen Montagsmailer) started as a blog and newsletter driven by a small team of volunteers passionate about environmental topics. The initial focus on the environment has broadened to sustainability and human rights.
Over time, growing experience and financial resources have contributed to a more and more professional organisation. Das Lamm aims to develop a revenue model based on its readership to make and keep its work going and accessible to everyone free of charge. Its motto, ""independent, critical, no paywall, no advertising"", remains the guiding principle. For now, grants from philanthropic foundations cover parts of the cost, and the work remains partly unpaid. Das Lamm also won several prizes, such as the Herbert Quandt Media Prize in 2021.",23-Feb,"Zürich, Switzerland",2012,German,"Entertainment and culture, Economy and business, Lifestyle, Environment, Politics, Society and human rights, Gender, Feminism, LGBTIQ+, Ethnic minorities, Religious minorities, Refugees, Migration"
Tripe + Drisheen,https://tripeanddrisheen.substack.com/,https://twitter.com/TDrisheen,https://www.facebook.com/tripeanddrisheen/,https://www.instagram.com/tripeanddrisheen,,"Tripe + Drisheen is a reader-supported newsletter about Cork city and county. It aims to publish independent, in-depth local journalism pieces, best captured by its motto, ""slow news is good news"".
Founded by journalists Ellie O'Byrne and JJ O'Donoghue in February 2021, the publication features a mixture of news, investigative reporting, features, and opinions.
Tripe + Drisheen was born out of frustration with how local media usually operate. Local news outlets are often owned by international conglomerates, which operate under an ad-supported, click-driven model that forces journalists to churn out five to 10 stories daily.
The founders felt that this way of working does not fit local journalism. They wanted to build a new slow model, particularly important at the local level because stories require research and going out into communities, something not usually afforded to local publications. Tripe + Drisheen also prioritises bringing voices not heard into the mainstream media.
The publication's founders believe that great journalism changes the world, and that great local journalism changes the world in small, incremental ways. Tripe + Drisheen is widely read in Cork, particularly among local policy-makers, so O'Byrne and O'Donoghue have been able to see the local impact of their journalism.",23-Jan,"Cork, Ireland",2021,English,"Entertainment and culture, Lifestyle, Politics, Society and human rights, Gender, Feminism, LGBTIQ+, Ethnic minorities, Religious minorities, DEIA: Diversity, equity, inclusion and accessibility, Refugees, Migration"
Ruskeat Tytöt Media,https://www.ruskeattytot.fi/,,,https://www.instagram.com/ruskeattytotmedia/,https://www.youtube.com/channel/UCwBImE-bdGnAUbgwVS_fT7Q,"Ruskeat Tytöt Media (in English: Brown Girls Media) is the first Finnish cultural media outlet focused on including and representing the perspectives of racialised minorities and people with underrepresented genders in the Finnish media industry. The media outlet started in 2015 as a personal blog by writer Koko Hubara. In 2017, the blog became a non-profit organisation and an online publication.
Ruskeat Tytöt Media uses the term ""Brown"" to refer to the people society has racialised in Finland. In contrast, the term ""Girls"" in the media outlet's title relates to gender diversity and the media outlet's goal of showing the voices of those whose gender identity is systematically underrepresented.
Ruskeat Tytöt Media is editorially independent and free to read. Articles are published in Finnish or English. Its mission is to promote cultural exchange and social inclusion through arts and culture.
The media organisation currently works with rotating guest editors and the writers are both freelance established journalists as new voices. The digital magazines explore various journalism genres, styles, and media formats, including audio and video; the articles dive into topics such as identity, complex societal issues, and feminist thought and theory.
In addition to the online publication, the organisation runs a writing course to promote underrepresented voices in the Finnish literature and media industry.",23-Jan,"Helsinki, Finland",2017,"English, Finnish","Science, Entertainment and culture, Economy and business, Economy and finance, Education, Lifestyle, Environment, Politics, Health and well-being, Society and human rights, Gender, Feminism, LGBTIQ+, Ethnic minorities, Religious minorities, DEIA: Diversity, equity, inclusion and accessibility, Refugees, Migration, Technology"
Nialler9,https://www.nialler9.com/,https://twitter.com/Nialler9,https://www.facebook.com/Nialler9music,https://www.instagram.com/nialler9/,,"Launched in 2005 by Niall Byrne, Nialler9 has become Ireland’s most-read music news publication, with over 55,000 unique website visitors each month. It covers industry news, new music releases, and gig and festival announcements. Nialler9 also issues a weekly newsletter.
Readers can contribute to supporting Nialler9 through Patreon for subscriber-only information, with memberships ranging from five to 15 euros per month.
The website has won numerous awards since its establishment. It was named Best Music Site at the Irish Web Awards (2009, 2013, and 2014) and won Best Music Blog five times at the Irish Blog Awards.",23-Jan,"Dublin, Ireland",2005,English,Entertainment and culture
The Bureau of Investigative Journalism,https://www.thebureauinvestigates.com/,https://twitter.com/TBIJ,https://www.facebook.com/thebureauinvestigates,https://www.instagram.com/thebureauinvestigates/,,"Public interest investigations, exposing wrongdoings, holding power to account, and focusing on social justice and accountability are some of the aims of The Bureau of Investigative Journalism (TBIJ). Founded in 2010 by David and Elaine Potter, it wants to make a real difference in journalism at a global, national, and local level.
The Bureau of Investigative Journalism works in collaboration with local and international media organisations, broadcasters, and organisations to maximise the impact of its investigations.
""We intend to crusade against the backward drift of human rights, to demand and deliver transparency and the hard pursuit of truth,"" co-founder Elaine Potter has said about the organisation's mission.
The Bureau of Investigative Journalism works on various investigative projects: Smoke Screens is an investigative podcast delving into ""the shadowy world of corporate espionage in the tobacco industry"", Global Health reveals systemic harms and barriers to health care worldwide, Big Tech investigates how the government gathers and uses our data and the companies it is paying, Environment reveals how industrial food devastates the planet and drives climate change, and The Enablers investigates how UK executives, lawyers, and advisors enable oligarchs, dictators, and criminals worldwide.
Part of The Bureau of Investigative Journalism, The Bureau Local is a collaborative investigative network revealing stories that matter to communities across the UK, such as the housing crisis, health inequality, domestic violence, and social inequalities. The People's Newsroom is an initiative aiming to build a sustainable network of community journalism.
Through the Bureau Local's Open Resources, the network aims to make the investigative process accessible to local reporters and the public. Here, the audience can find the behind-of-scenes of its investigations and guides for exploring or delving deeper into Bureau Local and TBIJ stories.
The organisation's revenue streams are donations from foundations and individuals, and grants from various organisations.",23-Feb,"London, United Kingdom",2010,English,"Economy and business, Economy and finance, Law and crime, Environment, Politics, Health and well-being, Society and human rights, Gender, DEIA: Diversity, equity, inclusion and accessibility, Refugees, Migration, War crimes and transitional justice, Technology"
