Name,Link,Twiter,Facebook,Instagram,Youtube,Description,LastUpdate,Location,Year Publishing,Language,Content
Serhat News,https://www.serhatnews.com/,https://twitter.com/serhat_news,https://www.facebook.com/serhatnews,https://www.instagram.com/serhat.news/,https://www.youtube.com/@SERHATNEWS,"Serhat News is an outlet founded by the non-profit organisation Dijital Medya Derneği (in English: Van Digital Media Association), covering the country's eastern region in Turkish, Kurdish, and English.
The media outlet is based in Van, a crucial passage point for refugees, primarily from Afghanistan and Iran. It covers migration, refugees and political issues related to the Kurdish minority.
The team is made up primarily of female directors and reporters, and publishes approximately 10 original reporting pieces daily.
The founders are adamant about diversifying revenue sources: they have in-house employees for local advertising and staff dedicated to grant project management. They also produce video content for international news outlets.
The website regularly comes under cyber-attacks; its journalists report being subject to physical violence on the ground, and the newsroom often faces lawsuits and police investigations. However, the founders are firmly determined to continue ""to show everyone that journalism can be done despite the politics of intimidation"".",23-Feb,"Van, Turkey",2021,"English, Kurdish, Turkish","Sports, Economy and business, Economy and finance, Journalism industry, Lifestyle, Law and crime, Religious minorities, Refugees, War crimes and transitional justice"
Daktilo1984,https://daktilo1984.com/,https://twitter.com/daktilo1984,https://www.facebook.com/daktilo1984,https://www.instagram.com/daktilo1984com/,https://www.youtube.com/channel/UCWyDy24AfZX8ZoHFjm6sJkg,"Daktilo1984 (in English: Typewriter) aspires to be a ""politically liberal publication"".
Founded by a group of academics and civil society members with economic and politically liberal ideologies, it publishes written pieces on its website. The articles are opinion and political essays, primarily concerning the immediate day-to-day news agenda. In addition, the newsroom produces videos for its YouTube channel and podcasts on Spotify.
The team relies on a vast network of contributors for text, audio, and visual content.
Within the newsroom, D84Intelligence and ASTERISK2050 teams write features, opinion pieces, and policy reports as content development for various NGOs.
An informal editorial board, mostly of academics, steers the editorial policy with an emphasis on freedom of expression, democracy issues and economics.",23-Feb,"Ankara, Turkey",2019,"English, Turkish","Entertainment and culture, Economy and business, Politics, Society and human rights, Gender, Feminism, LGBTIQ+, Ethnic minorities, DEIA: Diversity, equity, inclusion and accessibility"
Kutsal Motor,https://www.youtube.com/c/KutsalMotor/videos,https://twitter.com/KutsalMotor,,https://www.instagram.com/kutsalmotor/,https://www.youtube.com/c/KutsalMotor/videos,"Named after French filmmaker Leos Carax's movie Holy Motors, Kutsal Motor features conversations between three close friends with backgrounds in cinema criticism and arts journalism. The founders and contributors employ an ironic approach to discussions of popular culture and arts news.
The YouTube channel was established in 2018 with scant technological and financial means, and saw a meteoric rise in views and subscribers when it expanded its content to video essays, reviews, and reporting from film festivals.
The entirely original programming, consisting of more than 15 new videos monthly, offers various styles of video broadcasting, including live streaming and weekly AMA (Ask Me Anything) sessions.
The team deeply values connection with its committed audience and defines ""trust"" as a keyword to its success. Once a week, the founders meet on a Zoom call with some of their 1,600 paid YouTube members to chat and answer their questions.
Kutsal Motor has built a diversified portfolio of revenue sources to achieve financial sustainability, which includes event ticket sales, sponsorship and paid memberships.",23-Feb,"İstanbul, Turkey",2018,Turkish,"Entertainment and culture, Politics, Society and human rights"
Yeşil Gazete,https://yesilgazete.org/,https://twitter.com/yesilgazete,https://www.facebook.com/yesilgazete/followers,https://www.instagram.com/yesilgazete/,https://www.youtube.com/channel/UCefq5M5i3UbsnYIO1vKLvpQ,"Yeşil Gazete (in English: Green Newspaper) is one of the oldest digital native media outlets in Turkey and operates under a non-profit foundation.
It was launched in 2008 by professionals with backgrounds in science, environmental activism, and green issues. Over the years, the website established an institutional structure to formalise its professionalism in journalism.
An editorial board of six members advises the outlet on the green economy, agriculture, water, and food. A network of local freelancers reports nationwide through text and video on environmental issues. Some volunteers from the community manage some of the products, such as the newsletter and social media accounts.
The organisation finances itself through grants, donations and advertising. However, in line with its values, it chooses which advertising to accept to avoid companies aiming to greenwash. In 2023, it plans to launch a video production service as a revenue stream.
Yeşil Gazete is eager to produce more information in cross-border collaboration with other newsrooms, focused on the European climate crisis.",23-Feb,"İstanbul, Turkey",2008,"English, Turkish","Science, Environment, Politics, Society and human rights"
Caerphilly Observer,https://caerphilly.observer/,https://twitter.com/CaerphillyObsvr,https://www.facebook.com/caerphillyobserver,,,"Caerphilly Observer publishes local news, business news, opinion pieces, and sports news on football and rugby.
It started in 2009 as a news website when founder and journalist Richard Gurner was working and living in Brighton, 200 miles away from his hometown in Wales. It was challenging for him to try and find out what was happening back home, so he decided to move back to Wales in 2011 and focus on the Caerphilly Observer full-time.
""It is certainly not easy doing what we do, but we are passionate about providing a quality local news service,"" Gurner explained.
In 2013, Caerphilly Observer started a fortnightly free print edition with a local government grant. The organisation finances itself with a mix of advertising through sponsored content, as well as memberships, introduced after the pandemic.
The newspaper, with a circulation of 10,000 issues, is distributed through various local outlets, including shops, newsagents, petrol stations, council offices, and libraries.
Caerphilly Observer has won several journalism awards for its work. In 2018, it received the Independent Community News Service of the Year and, in 2020, the News Website of the Year, both at the Wales Media Awards.
Caerphilly Observer is regulated by the Independent Press Standards Organisation (IPSO) and is a member of the Independent Community News Network (ICNN).",23-Jan,"Caerphilly, United Kingdom",2009,English,"Entertainment and culture, Sports, Economy and business, Entrepreneurship, Economy and finance, Education, Lifestyle, Law and crime, Environment, Politics, Health and well-being, Society and human rights, Gender, Feminism, DEIA: Diversity, equity, inclusion and accessibility, Refugees, Migration, Technology"
Real Media,https://realmedia.press/,https://twitter.com/realmediagb,https://www.facebook.com/realmediaUK/,https://www.instagram.com/realmediauk/,https://www.youtube.com/channel/UChILjk2g64mZuwfkFPFeQRg,"Real Media is a cooperative of journalists dedicated to producing public interest stories. It exposes crimes, especially environmental ones, and was the Best Environmental Reporting winner at the Independent Media Awards 2022.
It also reports on the health industry and discloses injustices, contributing to the debate on national problems. When covering politics, Real Media is concerned not only about what is happening in the government area of Westminster, but also how communities are organising to challenge the decisions that affect them. The newsroom investigates matters overlooked by mainstream media, shifting corporations' ownership models and bringing a more plural media ecosystem to the UK.
Political actions, protests and actions organised by community groups and organisations, and interviews with members of marginalised communities and experts from diverse backgrounds stimulate the discussion of issues left out of other news coverage.
Real Media focuses on debates on a local level but also discusses international issues that matter to its audiences. It has dedicated spaces for the coverage of the environment, policing, NHS, and weapons traffic.
In collaboration with Phoenix Media Co-op, it releases a weekly newsletter. The media outlet works with campaign organisations aiming to shift and widen the public debate on various issues.
It is an Independent Media Association member and Co-operatives UK certified member. Its revenue comes from grants from philanthropic organisations and individual donations.",23-Jan,"London, United Kingdom",2016,English,"Science, Education, Law and crime, Environment, Politics, Health and well-being, Society and human rights, Ethnic minorities, DEIA: Diversity, equity, inclusion and accessibility, Refugees, Migration, War crimes and transitional justice"
Tortoise,https://www.tortoisemedia.com/,https://twitter.com/tortoise,https://www.facebook.com/AgathaTheTortoise,https://www.instagram.com/tortoise/,,"In the race to understand the world, when everyone is running to find out about everything, Tortoise is building ""a different type of newsroom, for a slower, wiser news"".
An independent media outlet, Tortoise was founded in 2018 by the former Times editor and BBC director of news James Harding; the US Ambassador to Sweden and then the UK, Matthew Barzun; and the former president of the Wall Street Journal and Dow Jones, Katie Vanneck-Smith.
In order to launch, the media outlet launched a Kickstarter campaign in October 2018, raising £539,035 — exceeding its target of £75,000. A membership media organisation, Tortoise is funded by 50,000 paid members, individuals and organisations, and by various partners.
The organisation focuses on five main topics, defined as ""the big five forces shaping our lives, societies, our world"": technology, natural resources, identity, finance, and longevity.
In ThinkIns, a series of editorial meetings and online and in-person events, Tortoise encourages input from members to inform Tortoise journalists' future reporting.
Since its creation, Tortoise has produced trendy podcast series such as Hoaxed, investigating one of ""the most serious British conspiracy theories of all time"". Tortoise audio has ""Slow News stories designed for listening"" such as The Slow Newscast, Editor's voicemail, and Sensemaker Daily. Understanding its audience's preference for listening to its long-reads content, in 2022, it expanded into audio.
A recent deal with Sky group will adapt Tortoise's original podcasts into high-end series and features across scripted and documentaries.",February 2023.,"London, United Kingdom",2019,English,"Science, Entertainment and culture, Economy and business, Education, Law and crime, Environment, Politics, Health and well-being, Society and human rights"
A Little Bit of Stone,https://alittlebitofstone.com/,https://twitter.com/bitofstone?lang=en,https://www.facebook.com/alittlebitofstone/,https://www.instagram.com/alittlebitofstone/,https://www.youtube.com/c/Alittlebitofstone,"When the journalist Jamie Summerfield moved to Stone, a canal town and popular holiday destination with around 17,000 residents, he felt the community lacked media attention and decided to launch a ""trusted and professional news website"". He founded A Little Bite of Stone in 2010. Soon afterwards, Jon Cook, the current director of the project, also new to the area, decided to join the initiative to give Stone residents a voice in the independent news.
After 12 years of operating with a small team and trying to keep the project running, A Little Bit of Stone is known in the local community as it helps residents understand what is happening around them. The media outlet publishes news about the town of Stone and also, according to availability, about the surrounding villages of Aston, Oulton, Swynnerton, and Yarnfield.
Its mission is to produce and share stories about the Stone community, connect residents, and promote local businesses and services. Community members are encouraged to send their contributions to the website.
Every Thursday, the newsroom publishes the Stone What's On Guide with events and activities happening in the town. The section Stone Town has information about how to get to the town, the services available in the area, the history of Stone, famous people associated with the place, and traditional industries in the city.
A Little Bit of Stone is sustained by advertising and individual donations. According to Cook, there are many challenges to maintaining the project, but the positive impact on the community motivates the team to keep going.",23-Jan,"Stone, United Kingdom",2010,English,"Entertainment and culture, Economy and business, Law and crime, Politics, Health and well-being"
Republik,https://www.republik.ch/,https://twitter.com/RepublikMagazin,https://www.facebook.com/RepublikMagazin,https://www.instagram.com/republikmagazin/,,"Republik is an independent, reader-owned, and advertising-free digital media outlet launched in Switzerland in January 2018. Published in German, the newsroom follows this principle: ""Without journalism, there no democracy. And without democracy, there is no freedom"". It covers political, economic, societal, and cultural issues.
The media publishes several daily articles that can be read by paying members and subscribers through the website, the newsletter, or the media outlet's mobile application.
It was founded through a crowdfunding campaign in 2017. To date, Republik is supported by its readers and is wholly transparent, systematically disclosing information about finances, ownership, working methods, and wages.
With its headquarters in Zurich, the media outlet works under two separate organisations that are both intrinsic to its business model. Its largest owner, the company Project R, is a non-profit cooperative that takes on all development costs: research, conception, open-source technologies, and training. The newsroom itself is organised as a company, Republik AG. The organisation's revenue comes from audience memberships and donations, and finances are published in the annual report (2020-2021).
The media outlet has won several Swiss journalism awards and the European Publishing Award as the European Start-up of the Year in 2019.",February 2023.,"Zürich, Switzerland",2017,German,"Science, Entertainment and culture, Economy and business, Education, Law and crime, Environment, Politics, Society and human rights, Gender, Feminism, LGBTIQ+, Ethnic minorities, Religious minorities, DEIA: Diversity, equity, inclusion and accessibility, Refugees, Migration, War crimes and transitional justice, Technology"
Journal21,https://www.journal21.ch/,https://twitter.com/journal21,https://www.facebook.com/Journal21/,,,"Journal21 is a Swiss independent digital magazine founded in 2010 by Heiner Hug, the former editor-in-chief of the public broadcaster's evening news programme Tagesschau. The media outlet publishes daily in-depth analysis, opinion, background reports, and features on Switzerland's current political, economic, and cultural affairs.
All the information is produced by a large team of experienced journalists who have worked or are still working for significant Swiss media houses and contribute to Journal21 voluntarily.
Intending to make the team's knowledge, experience, and analysis available to an interested audience, all publications on Journal21 are freely accessible. A daily newsletter informs readers about newly published articles.
Most of the pieces are in German; however, articles are occasionally published in French, English, and Italian.
The media outlet is run by the non-profit association Journal 21 and receives contributions from patrons and single donations.",February 2023.,"Zürich, Switzerland",2010,"English, German, French, Italian","Entertainment and culture, Economy and business, Economy and finance, Politics, Society and human rights"
Bon pour la tête,https://bonpourlatete.com/,https://twitter.com/bonpourlatete,https://www.facebook.com/bonpourlatete/,https://www.instagram.com/bonpourlatete_/,,"Bon pour la tête (in English: Good for your head) is an independent French-speaking digital media outlet founded in Romandy in 2017.
After the closure of the weekly magazine L'Hebdo, edited in the city of Lausanne, former employees of L'Hebdo and Le Temps founded a non-profit association, Bon pour la tête, to support the launch of an independent news media outlet aiming to broaden the scope of information and debate. The group of journalists launched a crowdfunding campaign, and within five weeks, the campaign raised approximately 215,000 euros.
The media outlet publishes Swiss and international news coverage and in-depth analysis of various topics, including politics, the environment, history, culture, and humour. It also publishes original information, primarily in French, and curates articles published in other media outlets in and outside Switzerland.
Free of advertising, exclusive articles are protected behind a paywall and made available upon subscription, which finances the work that is ""modestly remunerated"". The organisation is run by the non-profit association Bon pour la tête, led by a committee of volunteers.",February 2023.,"Vevey, Switzerland",2017,French,"Science, Entertainment and culture, Economy and business, Environment, Politics, Society and human rights, Technology"
Heidi.news,https://www.heidi.news/,https://twitter.com/heidi_news,https://www.facebook.com/Heidi.news,https://www.instagram.com/heidi.news/,https://www.youtube.com/channel/UCfYpN94AT2g4_gyJb0G_AmA,"Heidi.news is an independent online media launched in Romandy in 2019. The media outlet publishes daily news, thematic newsletters, and extensive reports and surveys on science, health, and innovation topics.
Aiming to be a helpful media outlet and to publish constructive journalism, the team of 15 journalists works to produce independent and reliable information daily and to offer accurate and in-depth analysis, constructive perspectives, and solutions rather than sensational perspectives.
Free of advertising, Heidi.news has a subscription-based revenue model that makes articles accessible only to subscribers.
It is published by the Geneva-based company Heidi Media SA and financed by its readers through paid subscriptions and Explorations' print reviews. By creating Heidi Solutions, Heidi.news also generates income by offering editorial expertise and training services.
The Aventinus Foundation, whose goal is to support independent press and media, contributed to the initial funding. In November 2020, the foundation announced that it would acquire Heidi.news. Now, the organisation shares its editorial director with the Le Temps, which has also become the foundation's property.",February 2023.,"Geneva, Switzerland",2019,French,"Science, Environment, Health and well-being, Technology"
Bajour,https://bajour.ch/,https://twitter.com/bajourbasel,https://www.facebook.com/bajourbasel/,https://www.instagram.com/bajourbasel/,,"Bajour is an independent local online media outlet made in and for Basel. Bajour covers events and publishes analysis using playful, creative formats to strengthen the debate across generations about local issues, civic engagement, and democracy.
The media outlet started in 2019 with a daily newsletter, Basel Briefing, which summarises the most important events and delivers them in the morning. The newsletter FCB Briefing provides soccer fans with up-to-date information on the day of a match. In addition, the media outlet publishes more in-depth reporting and addresses underreported topics by going to the streets of Basel to find out what concerns its citizens.
Bajour considers itself a local media outlet and aims to connect people, take questions, organise debates, and look for solutions. In the context of the Covid-19 pandemic, in March 2020, Bajour launched Gärn gschee – Basel helps, an initiative bringing together people who needed help with those who could provide it.
The media outlet is published and supported by the non-profit association Medienzukunft Basel and received initial funding from the Stiftung Medienvielfalt (in English: Foundation for Media Diversity). It is also part of a national network of local media start-ups (Tsüri and Kultz) that publish and share content on We.publish's digital infrastructure.",February 2023.,"Basel, Switzerland",2019,German,"Entertainment and culture, Sports, Economy and business, Lifestyle, Environment, Politics, Health and well-being, Society and human rights"
Fempers Nyheter,https://fempers.se/,https://twitter.com/fempers,https://www.facebook.com/Fempersny/,https://www.instagram.com/fempers,,"The Swedish feminist digital magazine started in 2011 as Feministiskt Perspektiv and continued in 2021 under the name Fempers Nyheter, published by the media company Medieföretaget Fempers AB.
The online magazine, updated twice a week, on Tuesdays and Fridays, publishes news, interviews, features, and opinion pieces. Aside from the website, Fempers Nyheter publishes quarterly printed magazines.
The platform is feminist, the CEO Anna-Klara Bratt says, on three levels: editorially, politically, and staff-wise. ""Our viewpoint offers new perspectives on journalism, class, race, finances, and the government.""
Bratt used to be the editor-in-chief of the socialist newspaper Arbetaren. Under her management, the newspaper became pronouncedly feminist and gender-balanced, which meant that it came to be characterised by equal participation and representation of women and men.
In 2007, she published the book Könsbalans: så jobbar du jämställt (in English: Gender balance: how to work equally) with Mian Lodalen.",23-Feb,"Stockholm, Sweden",2011,"English, Swedish, Spanish, Persian, Romani, Bengali","Entertainment and culture, Sports, Education, Law and crime, Politics, Health and well-being, Society and human rights, Gender, Feminism, LGBTIQ+, Ethnic minorities, DEIA: Diversity, equity, inclusion and accessibility, Refugees"
Siljan News,https://www.siljannews.se/,,https://www.facebook.com/SiljanNews/,https://www.instagram.com/mitt_i_dalarna/?hl=nl,https://www.youtube.com/channel/UCbTaUaPvtyQW8CZ6qID4Yjg,"Siljan News is a local media company aiming to be the primary news source for people living in the Swedish region of Dalarna. Siljan News has a ""politically independent newsroom and always strives to be impartial and objective in its news reporting"".
Before the media organisation was launched in 2017, the sparsely populated towns and cities of Dalarma were largely overlooked due to the centralisation of most Swedish media organisations.
""Regional media downsized their presence in these communities,"" the co-founder and CEO Thorbjörn Carlsson says. ""We wanted to move in the opposite direction: to decentralise and therefore be closer to our readership.""
If nobody covers the region you live in, Carlsson said, ""you start to think you and your community are unimportant"". Siljan News has different websites for each municipality they cover. These are: Gagnef, Orsa, Mora, Rättvik, Säter, Leksund, Älvdalen, Vansbro, and Malung-Sälen.",23-Feb,"Dalarna, Sweden",2017,Swedish,"Entertainment and culture, Sports, Economy and business, Entrepreneurship, Economy and finance, Law and crime, Environment, Politics, Health and well-being, Society and human rights, Refugees, Migration"
