Name,Link,Twiter,Facebook,Instagram,Youtube,Description,LastUpdate,Location,Year Publishing,Language,Content
Notes from Poland,https://notesfrompoland.com/,https://twitter.com/notesfrompoland,https://www.facebook.com/notesfrompoland,https://www.instagram.com/notesfrompoland_/?hl=en,https://www.youtube.com/c/BBCNews,"Notes from Poland is the leading independent source of English-language news and analyses of Polish's current affairs. The organisation provides daily reports on what is happening in the country with the insights, context, and background necessary to help the world understand it.
The daily news coverage intends to offer unbiased reporting, including all the points of view of a story, while regular analyses and opinion articles present a wide range of perspectives on Poland, both from within and outside the country.
Since its launching in 2019, the media outlet has grown to answer an increasing interest in the country. Notes from Poland was named one of the media start-ups to watch in 2021 by Sifted.eu. Its reporting and insights have been featured in various international media, including the BBC, Foreign Policy, and the Financial Times.
Notes from Poland's advisory board includes Nobel Prize winner Olga Tokarczuk, historian Norman Davies, and Timothy Garton Ash, professor of European Studies at the University of Oxford.
The non-profit Notes from Poland Foundation manages the media outlet. Notes from Poland is funded through grants and donations from readers and supporters.",23-Jan,"Kraków, Poland",2019,"English, Polish","Science, Entertainment and culture, Economy and business, Economy and finance, Education, Law and crime, Environment, Politics, Health and well-being, Society and human rights, Gender, Feminism, LGBTIQ+, Ethnic minorities, Religious minorities, DEIA: Diversity, equity, inclusion and accessibility, Refugees, Migration, War crimes and transitional justice"
Raport o Stanie Swiata,https://raportostanieswiata.pl/,https://twitter.com/DariuszRosiak,https://pl-pl.facebook.com/raportostanie/,https://www.instagram.com/dariusz_rosiak/,,"Raport o Stanie Swiata (in English: Report on the State of the World) is an independent platform producing commentaries and reports on world events through podcasts and live programmes from different locations. It was launched in February 2020.
The organisation produces the State of the World Report, a weekly dose of new stories about the world, commentaries, reports, and columns; and Report for Today, a weekly podcast published on Wednesdays, which selects one newsworthy story and talks about it as long as it takes to understand it, get to know its characters, and interpret its meaning.
Other podcasts are Book Report, in which the team discusses books and reads them with great actors' voices; Report Specials, which produces theatre productions, music concerts, and live programmes with audience participation; and Report from the Future, a radio play about how the world is changing.
In 2021, Dariusz Rosiak, the founder, received the Podcaster of 2020 award from Podcast Roku. ""For professionalism, reliability, and variety of forms within one episode. Transfer of experience from radio to the podcast.""
The State of the World Report is a programme financed by listeners through the Patronite service.",23-Jan,"Warsaw, Poland",2020,Polish,"Science, Environment, Politics, Society and human rights, Gender, Feminism, LGBTIQ+, Ethnic minorities, Religious minorities, DEIA: Diversity, equity, inclusion and accessibility, Refugees, Migration, War crimes and transitional justice"
Polityka Insight,http://www.politykainsight.pl/en,https://twitter.com/PolitykaInsight,https://www.facebook.com/PolitykaInsight,https://www.instagram.com/politykainsight/,https://www.youtube.com/c/PolitykaInsightYT,"Polityka Insight is Poland's first knowledge platform for business leaders, policymakers and diplomats. It has been active since 2013 and has three business lines: it publishes analytical services available by subscription (PI Premium, PI Finance, PI Energy, PI Energy & Climate Weekly); prepares studies, presentations and training courses on behalf of companies, public administrations and international organisations; and organises thematic debates and conferences.
Since 2017, it has been recording podcasts in which analysts and experts comment on major political and geopolitical, economic, technological, health, and energy events. Polityka Insight uses various channels of communication such as its website, newsletter and social media. It operates on a subscription model devoid of adverts and sponsored content, while most studies and all podcasts are freely available to the public (outside of the paywall).
The key to the analysts' work is to select information and data and dig deeper. They select what is relevant and investigate using the outlet's own analytical method. Polityka Insight reacts at the speed of the media, but works to the standard of academic analysis.
In a world of constant change, it provides a solid analysis of events, processes and trends, which is why Polityka Insight is recognised as an expert, opinionated and credible source.",23-Jan,"Warsaw, Poland",2013,"English, Polish","Economy and business, Entrepreneurship, Economy and finance, Journalism industry, Law and crime, Environment, Politics, Health and well-being, Society and human rights, Gender, Feminism, LGBTIQ+, Ethnic minorities, Religious minorities, DEIA: Diversity, equity, inclusion and accessibility, Refugees, Migration, Technology"
Klub Jagielloński,https://klubjagiellonski.pl/,https://twitter.com/KlubJagiellonsk,https://www.facebook.com/KJagiellonski,https://www.instagram.com/klubjagiellonski/,https://www.youtube.com/c/KlubJegiello%C5%84sk,"Klub Jagielloński (in English: the Jagiellonian Club) is an association with almost 30 years of experience. A group of Jagiellonian University students initiated the first activities of today's Klub Jagielloński in March 1988. In 1994, Klub Jagielloński was granted a legal status. Over the years, the association has organised debates, discussion meetings and seminars, published a journal of ideas, and conducted educational and expert projects.
In 2013, the association launched the website jagiellonski24, renamed Klub Jagiellonski, which publishes opinions, analyses, and essays by Klub Jagiellonski authors.
Klub Jagiellonski develops the idea of New Christian Democrats, whose pillars are republicanism, conservatism, and Catholic social teaching. Polish current events are commented on, but also lengthy analyses, expert issues, or social topics, including those that have no place in the mainstream debate. The Klub communicates its activities extensively on Facebook, Instagram, LinkedIn and Twitter, as well as through a newsletter addressed to readers and supporters.
Furthermore, the media outlet produces podcasts and YouTube videos on politics, culture, urban affairs, and international topics. These podcasts are Intercity, Devoted Culture, After America, ScepTech, QuickCulture, ClubWeekly and Dear Country.
Each month, the association organises open debates, meetings, seminars and lectures online and live, free of charge, in several cities in Poland, aiming to increase civic education and create a space to discuss relevant issues.
In the Klub, expert knowledge is combined with everyday patriotism and new technologies. The organisation developed the app Pola. Take her shopping, which educates and supports consumer patriotism.
The expert pillar of the association is the Analysis Centre, a think tank whose mission is to develop advanced diagnoses and solutions to the most significant problems of Polish public life. The centre produces cross-sectional reports and commentaries on changes in the law published on the Klub Jagiellonski. Additionally, the centre's experts provide unique knowledge to the media through various channels.
Klub Jagiellonski finances its work through grants, subsidies, donations, and crowdfunding.",23-Jan,"Kraków, Poland",2013,"English, Polish","Science, Entertainment and culture, Economy and business, Entrepreneurship, Economy and finance, Journalism industry, Education, Lifestyle, Law and crime, Environment, Politics, Health and well-being, Society and human rights, Gender, Feminism, LGBTIQ+, Ethnic minorities, Religious minorities, DEIA: Diversity, equity, inclusion and accessibility, Refugees, Migration, War crimes and transitional justice, Technology"
Kultura Liberalna,https://kulturaliberalna.pl/,https://twitter.com/kultliberalna,https://www.facebook.com/KulturaLiberalna/,https://www.instagram.com/kulturaliberalna/?hl=en,https://www.youtube.com/user/KulturaLiberalna,"Kultura Liberalna (in English: Liberal Culture) is an intellectual milieu created around a non-profit, socio-political, weekly magazine established in 2009 by a group of young academics, artists, journalists, students and freelancers.
Devoted to modernising liberal thought according to the forthcoming theoretical and practical challenges, it also strives to apply liberal ideals to the specific, Central European historical experience.
It publishes interviews, opinion pieces, and analyses on current political, social, and economic issues and developments, human rights, the rule of law, climate change, geopolitics, film, theatre, books, and music reviews.
It publishes 52 online weekly magazines annually, released every Tuesday, organises public debates and seminars, and publishes books on contemporary politics and culture.
Kultura Liberalna aims to build a better Poland for future generations. Furthermore, it seeks to strengthen and modernise Polish liberal thought in line with the experiences of Central and Eastern Europe, and to participate in international debates on socio-political and cultural issues.
The team is independent of politicians and advertisers.
Kultura Liberalna emphasises the intellectual and linguistic quality of the published articles. Established as a leading liberal magazine in Poland, its contributors include many eminent scholars, artists, politicians, and journalists such as: Lech Walesa, Saskia Sassen, Timothy Garton-Ash, Michael Walzer, Paul Berman, Adam Michnik, Richard Wolin, Quentin Skinner, Zygmunt Bauman, Aleksander Smolar, Krzysztof Penderecki, and Agnieszka Holland.",23-Jan,"Warsaw, Poland",2009,"English, Polish, German, French","Entertainment and culture, Economy and business, Economy and finance, Education, Law and crime, Environment, Politics, Health and well-being, Society and human rights, Gender, Feminism, LGBTIQ+, Ethnic minorities, Religious minorities, DEIA: Diversity, equity, inclusion and accessibility, Refugees, Migration, War crimes and transitional justice"
Radio Nowy Swiat,https://nowyswiat.online/,https://twitter.com/RadioNowySwiat?ref_src=twsrc%5Egoogle%7Ctwcamp%5Eserp%7Ctwgr%5Eauthor,https://pl-pl.facebook.com/RadioNowySwiat/,https://www.instagram.com/radio_nowyswiat/,,"Radio Nowy Swiat (in English: New World Radio) was created thanks to a group of journalists who, over the past few years, have attempted to develop the first internet radio for listeners for whom radio is more than just a medium. Polish journalists, formerly from public radio, founded the internet radio following redundancies by the new government, led by the Law and Justice party.
It aims to be the first commercial radio station; that is why the media outlet has already taken young talents and budding reporters under its wings and plans to promote Polish bands who, for various reasons, fail to make their way through the mainstream. The organisation will patronise cultural events, records, concerts, and literary meetings, mixing and turning things upside down.
To become patrons of Radio New World, people have two options: support the radio via Patronite or directly donate to the radio's account.",23-Jan,"Warsaw, Poland",2021,Polish,"Entertainment and culture, Lifestyle, Politics, Society and human rights"
Outriders,https://outride.rs/pl/,https://twitter.com/outrid3rs,https://www.facebook.com/outrid3rs/,https://www.instagram.com/outrid3rs/,,"Founded in 2017, Outriders is a non-profit newsroom covering global issues with an impact on the life of local citizens. The newsroom seeks answers to problems, fears, and needs.
It comprises a group of journalists reporting and explaining phenomena and events worldwide. There is less and less room in newsrooms for experienced reporters and foreign correspondents because their work is too expensive. Airtime devoted to global affairs is declining. At Outriders they cover the world because they are finding it harder and harder to understand it.
The newsroom experiments with new narrative formats; for example, it publishes reportage with a computer game and a storyline.
Outriders is a non-partisan organisation that aims to publish unbiased, accurate, and reliable information, working alongside journalists reporting from the ground.
Outriders publishes a magazine and a podcast, organises a festival, and produces a range of innovative products and materials. It also runs a club that brings together people who want to understand the changes happening in the world.
In 2017, Outriders received the Grand Press Digital Award for its innovative approach to journalism using new technologies.",23-Jan,"Warsaw, Poland",2017,"English, Polish","Economy and business, Economy and finance, Education, Lifestyle, Environment, Politics, Health and well-being, Society and human rights, Gender, Feminism, LGBTIQ+, Ethnic minorities, Religious minorities, DEIA: Diversity, equity, inclusion and accessibility, Refugees, Migration, War crimes and transitional justice"
Frog News,https://frognews.bg/,https://twitter.com/FROGNEWSBG,https://www.facebook.com/profile.php?id=100041181593125,,,"The media outlet covers news, culture, and lifestyle; however, it stands for its investigative articles on law and crime, including prosecution, court, and police activities. It was founded in 2007 by Bulgarian investigative journalist Ognyan Stefanov.
Stefanov was brutally attacked in 2008 due to his investigations.
""The goal of the media outlet is to be independent and to stay behind our society's interests only,"" the founder explained. Frog News strives to provide quality information to readers while abiding by the highest journalist standards.
""The Frog News team strives to present learned information originally, to wake up, not put readers to bed. We do not avoid scandals, but look for them; if they are hidden, we provoke them to come to light,"" the website states.",22-Dec,"Sofia, Bulgaria",2007,Bulgarian,"Entertainment and culture, Sports, Economy and business, Education, Lifestyle, Law and crime, Environment, Politics, Health and well-being, Society and human rights, Technology"
Mediapool.bg,https://www.mediapool.bg/,https://twitter.com/Mediapoolbg,,https://www.instagram.com/mediapool.bg/,https://www.youtube.com/channel/UC8SmoUezKPHy_LNPjSru1BA,"Mediapool.bg is an independent news site. It covers stories of public interest, providing reliable facts, background, and analyses of the stories as they unfold. Mediapool.bg is a news site with entirely open access, including its archive.
The media outlet was launched in 2001 by the former director of the Government's Information Service, Stoyana Georgieva, who was also the public relations manager of the centre-right, pro-EU and pro-NATO Prime Minister, Ivan Kostov (1997-2001).
""In an increasingly deteriorating media environment and a steadily declining press freedom in Bulgaria, Mediapool.bg is one of the few news outlets in the country which continues to deliver trustworthy information to the public. Our reporters produce high-quality journalism thanks to their constant push for answers and a deep and comprehensive understanding of their respective fields,"" Georgieva said.
Mediapool.bg is entirely free, following citizens' fundamental right to be informed, as a well-informed public is the only way to keep power in check, which is a vital element of a functional democracy.",22-Dec,"Sofia, Bulgaria",2001,Bulgarian,"Science, Entertainment and culture, Sports, Economy and business, Education, Lifestyle, Law and crime, Environment, Politics, Society and human rights, Technology"
Alternativata,https://alternativata.bg/,,https://www.facebook.com/Alternativat,https://www.instagram.com/alternativatabg/,https://www.youtube.com/c/AlternativataBG,"Alternativata is a platform providing a space for independent journalists; its main project is a Youtube show called Alternativata. It has two additional shows: Alternatives: The Week, a one-hour weekly political show where guests present their points of view on the week's most important stories in Bulgaria, and Alternatives: Alarm Clock, a weekly show that mixes information and entertainment.
Alternativata is 100% funded by its viewers; it does not receive revenue from advertising, and none of its shows feature ads.
The organisation was founded by the former ambassador of Bulgaria to the Russian Federation, energy expert, and analyst Ilian Vassilev. The media outlet started inviting national security and energy experts to write analyses; after, some Bulgarian TV journalists founded the TV show on YouTube. Now, TV1 Bulgaria broadcasts the show as a weekly TV show.
Behind Alternativata is the Alternativi i Analizi Foundation (in English: Alternative and Analyses), created in 2019 by associates and friends of Alex Alexiev. The aim was to continue studying long-term trends in international relations in Southeastern and Eastern Europe and the Black Sea region, energy security, Russia-EU and Russia-NATO relations, climate change, and development in Bulgaria and the Balkans.
The foundation produces information in two sections: the first is the shows; the second is publishing research, briefings, newsletters, and analyses, including disinformation and hybrid policies. The information is published on the website Altanalyses.",23-Jan,"Sofia, Bulgaria",2019,"English, Bulgarian, Russian","Economy and business, Entrepreneurship, Economy and finance, Journalism industry, Law and crime, Politics, Society and human rights, War crimes and transitional justice"
Armėno radijas,https://soundcloud.com/armenoradijas,,https://www.facebook.com/ARMENORADIJAS/,https://www.instagram.com/armenoradijas/?hl=en,https://www.youtube.com/c/armenoradijas,"Armėno radijas (in English: The Radio of an Armenian) is a podcast named after the ethnic origin of its only host, Marius Sukesian.
The podcaster produces audio commentaries, documentaries, and interviews on YouTube in the Lithuanian language. His goal is to provide ""quality productions for advanced minds"".
The podcast is financed by a community of supporters, who donate through Contribee and Patreon.",23-Jan,"Vilnius, Lithuania",2018,Lithuanian,"Science, Entertainment and culture, Economy and business, Law and crime, Environment, Politics, Health and well-being, Society and human rights, Technology"
Momichetata ot Grada,https://momichetata.com/,,https://www.facebook.com/momichetataotgrada,https://www.instagram.com/momichetata/,https://www.youtube.com/channel/UCAgjHkM2U_Vr4UVwGXBzLDg/featured,"Momichetata ot Grada (in English: The Girls from the City) is one of Bulgaria's largest independent women's sites. It covers urban culture, fashion, photography, lifestyle, literature, theatre, cinema, and food. The team aims to publish information about inspiring women of all ages that change the world around them in a positive way.
Momichetata ot Grada became popular when the magazine won the Website of the Year award from Forbes Bulgaria Magazine.
The organisation's team has also launched a printed magazine, and another website with news about Sofia, called Ot Grada (in English: From the City).
The team has also launched Mish Mash Fest, a street festival with books and handcrafted objects, located in Sofia's downtown Slaveykov Square.",22-Dec,"Sofia, Bulgaria",2011,Bulgarian,"Entertainment and culture, Education, Lifestyle, Politics, Health and well-being, Society and human rights, Gender, Feminism, LGBTIQ+, DEIA: Diversity, equity, inclusion and accessibility"
Bulgarian History,https://bulgarianhistory.org/,https://twitter.com/historybg,https://www.facebook.com/bulgarian.history1,https://www.instagram.com/bulgarianhistory/,https://www.youtube.com/user/BulgarianHistory1,"Bulgarian History is an online media platform specialising in the country's history. The media outlet aims to preserve and popularise Bulgaria's past through active publishing and production activities.
Apart from the media platform, the organisation has an online store with more than 100 educational publications.
Bulgarian History's most active communication channels are its Facebook page, followed by nearly 400,000 people, and its YouTube channel, with over 100,000 subscribers. YouTube is the platform chosen by the organisation to develop its production activity, including hundreds of short films.
Since its establishment in 2012, Bulgarian History has been working towards reviving historical memory, strengthening national pride, and reviving forgotten personalities and episodes from the recent and distant past.
Bulgarian History aims to reach everyone interested in the popular aspect of history, with priority given to the younger generation. That's why the team has been actively and voluntarily visiting schools since 2013. The organisation has met with more than 10,000 students over the last 10 years.
Bulgarian History is the winner of the 2020 Site of the Year Award for its overall contributions, and the Golden Lion Award for a publishing project with public significance.",22-Dec,"Sofia, Bulgaria",2012,Bulgarian,"Science, Entertainment and culture, Education, Society and human rights, War crimes and transitional justice"
Actualno.com,https://www.actualno.com/,https://twitter.com/ActualnoCom,https://www.facebook.com/actualnocom,,,"Actualno.com is an independent for-profit online media outlet in Bulgaria, with several small websites on lifestyle and women's topics.
Actualno.com provides unbiased and socially relevant information across politics, economy, culture, health, society, sports, international news, and education. The site also has two opinion sections: Actualno Comments and Point of View, which contain the analyses and comments of journalists from the newsroom and always provoke the public's interest. Actualno.com strongly supports authorship and independent points of view by encouraging young talent and inviting them as columnists.
According to the chief executive officer Kiril Apostolov and editor-in-chief Ivaylo Achev, the organisation aims to be financially and politically independent. The media outlet avoids being part of NGOs, professional associations, or applying for grants. The founder, Apostolov, is an IT entrepreneur who, after being an investor for five years, took over management of the media organisation to save it from bankruptcy after the 2008 financial crisis.
Actualno.com, as a media group, has several specialised online news outlets: Expert, iWoman, Sportlive, Sofialive, and Temida.",22-Dec,"Sofia, Bulgaria",2005,Bulgarian,"Science, Entertainment and culture, Sports, Economy and business, Education, Lifestyle, Law and crime, Environment, Politics, Health and well-being, Society and human rights, Technology"
sCOOL Media,https://scoolmedia.com/,,https://www.facebook.com/scoolmediaBG,https://www.instagram.com/scool_media/,https://www.youtube.com/channel/UCD2YA81-Igp_C3_9D0fpR_A,"sCOOL Media is part of the Media Literacy in the Classroom initiative by the Association of European Journalists-Bulgaria in cooperation with the Bulgarian Fulbright Commission and the America for Bulgaria Foundation. It aims to equip high school students in Bulgaria with the necessary skills to critically assess, interpret, and analyse information.
sCOOL Media aims to help build a new generation of reporters who can distinguish fact from fiction by developing their critical thinking in order to deal with the excess of information in the digital age.
sCOOL Media helps high school students become well-versed in the ways the media works, allowing them to work alongside experienced editors to produce quality pieces, and provides a platform to present their work to a wider audience.
Stories published on the bilingual site (in Bulgarian and English) follow journalistic ethics and standards, as the students also hone their skills in news-gathering, writing, and fact-checking and learn more about the profession.",22-Dec,"Sofia, Bulgaria",2019,Bulgarian,"Science, Entertainment and culture, Economy and business, Education, Society and human rights, Technology"
Pod tepeto,https://podtepeto.com/,https://twitter.com/podtepetocom,https://www.facebook.com/podtepetomedia,,,"Plovdiv's media outlet Pod tepeto (in English: Under the Hills) is one of the country's first regional digital media outlets. It prides itself on being among ""the few remaining truly independent"" media outlets.
Its newsroom is the winner of multiple journalism awards: the Plovdiv Award for journalism, the Courageous Reporters Award for investigating regional topics with a national resonance, and the Bulgarian Academy of Sciences and SBZ Award for the preservation and promotion of the archaeological and cultural heritage of Bulgaria.
Pod tepeto is quoted daily in national news channels.",22-Dec,"Plovdiv, Bulgaria",2009,"English, Bulgarian","Science, Entertainment and culture, Economy and business, Entrepreneurship, Economy and finance, Journalism industry, Education, Law and crime, Environment, Politics, Health and well-being, Society and human rights, Gender, Feminism, LGBTIQ+, Ethnic minorities, Religious minorities, DEIA: Diversity, equity, inclusion and accessibility, Refugees, Migration, War crimes and transitional justice, Technology"
